<?xml version="1.0" encoding="utf-8"?>
<levels xmlns:xsi="http://www.w3.org/2001/XMLSchema-instance"
        xsi:noNamespaceSchemaLocation="level_schema.xsd">
    <level name="Level1" width="800" height="600">
        <path>
            <node id="1" x="0" y="0" start="start">
                <successor refid="2" />
                <successor refid="4" />
            </node>
            <node id="2" x="200" y="200">
                <successor refid="3" />
            </node>
            <node id="3" x="100" y="30" goal="goal">
            </node>
            <node id="4" x="30" y="100" goal="goal">
            </node>
        </path>
        <towerzones>
            <rectangle x="3" y="9" width="30" height="40" />
            <rectangle x="30" y="90" width="50" height="80" />
            <rectangle x="60" y="20" width="80" height="80" />
            <rectangle x="200000" y="90000000" width="90" height="50" />
        </towerzones>
        <towers>
            <tower className="SmallTower" count="4" />
            <tower className="LargeTower" count="4" />
        </towers>
        <pads>
            <pad className="TeleportPad">
                <rectangle x="4" y="6" width="3" height="45" />
            </pad>
            <pad className="TeleportPad">
                <rectangle x="6" y="7" width="3" height="45" />
            </pad>
        </pads>
    </level>
</levels>
